team,elo_adjustment,form_multiplier,reason,source,date
USA,25,1.05,Host nation home advantage and strong group-stage form (won Group D),research,2026-06-26
Mexico,20,1.03,Host nation home crowds; won Group A,research,2026-06-26
Canada,20,1.04,Host nation; advanced as Group B runner-up with strong attack,research,2026-06-26
Brazil,15,1.05,Won Group C convincingly; Vinicius in golden-boot form,research,2026-06-26
Argentina,10,1.04,Messi leading golden boot (5); efficient progression,research,2026-06-26
Germany,10,1.03,Won Group E; Undav in form,research,2026-06-26
Norway,15,1.06,Haaland 4 goals; exceeded expectations in first WC,research,2026-06-26
Spain,5,1.02,Top seed form; Yamal/Morata scoring,research,2026-06-26
England,-10,0.97,Won group but underwhelming performances; Kane only 2 goals,research,2026-06-26
Belgium,-15,0.95,Struggled to only 3rd place in Group G; aging core,research,2026-06-26
Portugal,0,1.0,Ronaldo 3 goals but reliant on him; squad depth questions,research,2026-06-26
